{
  "schema_version": "1.0.0",
  "workspace_revision": 4,
  "query_digest": "f0323a7ae326cc52e2ce9787f0aeebfda5edec9c835fe37d75c247514bfb06e5",
  "applied_query": {
    "schema_version": "1.0.0",
    "text": "risk",
    "limit": 1
  },
  "records": [
    {
      "record_kind": "note",
      "record_id": "note.one",
      "title": "Why diversification matters",
      "body": "Diversification reduces exposure to risks that belong to one investment.",
      "target": {
        "reference_kind": "learning_opportunity",
        "owner_module": "curriculum",
        "opportunity_id": "opportunity.diversification",
        "placement_id": "placement.diversification",
        "package_id": "package.diversification",
        "package_version": "1.0.0",
        "package_digest": "aaaaaaaaaaaaaaaaaaaaaaaaaaaaaaaaaaaaaaaaaaaaaaaaaaaaaaaaaaaaaaaa",
        "source_fingerprint": "bbbbbbbbbbbbbbbbbbbbbbbbbbbbbbbbbbbbbbbbbbbbbbbbbbbbbbbbbbbbbbbb",
        "title": "Introduction to diversification",
        "destination": "/learn/placements/placement.diversification",
        "target_status": "available",
        "provenance": {
          "published_by": "Financial AI Academy",
          "published_at": "2026-10-16T14:00:00Z",
          "content_reviewed_on": "2026-10-16",
          "educational_use_notice": "For education and research; not personalized financial advice."
        },
        "validated_at": "2026-10-17T11:00:00Z"
      },
      "archived": false,
      "created_at": "2026-10-17T12:05:00Z",
      "updated_at": "2026-10-17T12:05:00Z"
    }
  ],
  "next_cursor": null
}
